{
  "contractVersion": "2.0.0",
  "durationMode": "standard",
  "episodeDate": "2026-08-17",
  "informationCutoff": "2026-08-17T04:59:02Z",
  "marketDate": "2026-08-14",
  "shortenedReason": null,
  "creativeReview": {
    "contract_version": "1.1.0",
    "episode_date": "2026-08-17",
    "findings": [],
    "immediate_failures": [],
    "reviewer": "editorial_critic",
    "round": 2,
    "scene_checks": [
      {
        "belief_changed": true,
        "closure_effective": null,
        "continuation_reason_natural": true,
        "mode": "continue",
        "opening_promise_recovered": null,
        "payoff_delivered": true,
        "procedural_language_dominant": false,
        "scene_id": "scene-01"
      },
      {
        "belief_changed": true,
        "closure_effective": null,
        "continuation_reason_natural": true,
        "mode": "continue",
        "opening_promise_recovered": null,
        "payoff_delivered": true,
        "procedural_language_dominant": false,
        "scene_id": "scene-02"
      },
      {
        "belief_changed": true,
        "closure_effective": null,
        "continuation_reason_natural": true,
        "mode": "continue",
        "opening_promise_recovered": null,
        "payoff_delivered": true,
        "procedural_language_dominant": false,
        "scene_id": "scene-03"
      },
      {
        "belief_changed": true,
        "closure_effective": null,
        "continuation_reason_natural": true,
        "mode": "continue",
        "opening_promise_recovered": null,
        "payoff_delivered": true,
        "procedural_language_dominant": false,
        "scene_id": "scene-04"
      },
      {
        "belief_changed": true,
        "closure_effective": null,
        "continuation_reason_natural": true,
        "mode": "continue",
        "opening_promise_recovered": null,
        "payoff_delivered": true,
        "procedural_language_dominant": false,
        "scene_id": "scene-05"
      },
      {
        "belief_changed": true,
        "closure_effective": null,
        "continuation_reason_natural": true,
        "mode": "continue",
        "opening_promise_recovered": null,
        "payoff_delivered": true,
        "procedural_language_dominant": false,
        "scene_id": "scene-06"
      },
      {
        "belief_changed": true,
        "closure_effective": null,
        "continuation_reason_natural": true,
        "mode": "continue",
        "opening_promise_recovered": null,
        "payoff_delivered": true,
        "procedural_language_dominant": false,
        "scene_id": "scene-07"
      },
      {
        "belief_changed": true,
        "closure_effective": true,
        "continuation_reason_natural": null,
        "mode": "close",
        "opening_promise_recovered": true,
        "payoff_delivered": true,
        "procedural_language_dominant": false,
        "scene_id": "scene-08"
      }
    ],
    "scores": {
      "clarity": 5,
      "discovery": 5,
      "fox_voice": 4,
      "late_payoff": 5,
      "opening": 5,
      "progression": 4
    },
    "total_score": 28,
    "verdict": "pass"
  },
  "production": {
    "corrections": [
      {
        "corrected": "SOXX ETF",
        "correctionId": "correction-001",
        "original": "Collector field `SOX`",
        "reason": "source_symbol is SOXX.US; it is not the PHLX SOX index."
      }
    ],
    "episodeType": "single-news",
    "financialBindings": [],
    "pronunciations": [
      {
        "reading": "アプライド・マテリアルズ",
        "surface": "AMAT"
      },
      {
        "reading": "エスオーエックスエックス",
        "surface": "SOXX"
      }
    ],
    "sources": [
      {
        "accessedAt": "2026-08-17T04:59:02Z",
        "narrationAttribution": "fresh Collector",
        "publishedAt": "2026-08-17T04:59:02Z",
        "publisher": "朝のNASDAQカフェ Collector",
        "reference": "daily-inputs/2026-08-17/daily_source_package_2026-08-17.md",
        "sourceId": "source-001",
        "sourceType": "market-data",
        "title": "Fresh Daily Source Package 2026-08-17",
        "usedFor": [
          "Nasdaq OHLC",
          "SOXX ETF",
          "AMAT/AVGO/AMD price moves",
          "collector lineage"
        ]
      },
      {
        "accessedAt": "2026-08-17T04:59:02Z",
        "narrationAttribution": "Applied Materials IR",
        "publishedAt": "2026-05-14T16:01:00-04:00",
        "publisher": "Applied Materials",
        "reference": "https://investor.appliedmaterials.com/news-releases/news-release-details/applied-materials-announces-second-quarter-2026-results",
        "sourceId": "source-002",
        "sourceType": "official",
        "title": "Applied Materials Announces Second Quarter 2026 Results",
        "usedFor": [
          "prior Q3 revenue/EPS guidance"
        ]
      },
      {
        "accessedAt": "2026-08-17T04:59:02Z",
        "narrationAttribution": "Applied Materials IR",
        "publishedAt": null,
        "publisher": "Applied Materials",
        "reference": "https://investor.appliedmaterials.com/events/event-details/q3-2026-applied-materials-earnings-conference-call",
        "sourceId": "source-003",
        "sourceType": "official",
        "title": "Q3 2026 Applied Materials Earnings Conference Call",
        "usedFor": [
          "Aug 13 4:30 PM ET timing"
        ]
      },
      {
        "accessedAt": "2026-08-17T04:59:02Z",
        "narrationAttribution": "Reuters",
        "publishedAt": "2026-08-13T20:05:23Z",
        "publisher": "Reuters",
        "reference": "https://www.reuters.com/business/applied-materials-forecasts-quarterly-revenue-above-estimates-2026-08-13/",
        "sourceId": "source-004",
        "sourceType": "major-media",
        "title": "Applied Materials forecasts revenue above estimates, shares fall on high expectations",
        "usedFor": [
          "Q3 actual",
          "Q4 guidance vs LSEG",
          "after-hours reaction",
          "high expectations",
          "advanced packaging"
        ]
      },
      {
        "accessedAt": "2026-08-17T04:59:02Z",
        "narrationAttribution": "Reuters",
        "publishedAt": "2026-08-14",
        "publisher": "Reuters",
        "reference": "https://www.reuters.com/business/wall-st-futures-muted-higher-oil-prices-temper-risk-appetite-after-sp-record-2026-08-14/",
        "sourceId": "source-005",
        "sourceType": "major-media",
        "title": "S&P 500 ends lower as investors weigh data, Middle East tensions",
        "usedFor": [
          "Nasdaq close",
          "AMAT/AVGO weakness",
          "AI valuation interpretation",
          "oil/Hormuz context"
        ]
      },
      {
        "accessedAt": "2026-08-17T04:59:02Z",
        "narrationAttribution": "米国勢調査局",
        "publishedAt": null,
        "publisher": "U.S. Census Bureau",
        "reference": "https://www.census.gov/retail/release_schedule.html",
        "sourceId": "source-006",
        "sourceType": "official",
        "title": "Monthly Retail Trade - Release Schedule",
        "usedFor": [
          "July retail sales release time"
        ]
      },
      {
        "accessedAt": "2026-08-17T04:59:02Z",
        "narrationAttribution": "Reuters",
        "publishedAt": "2026-08-14",
        "publisher": "Reuters",
        "reference": "https://www.reuters.com/world/asia-pacific/yens-slide-weekly-loss-prompts-bets-another-intervention-2026-08-14/",
        "sourceId": "source-007",
        "sourceType": "major-media",
        "title": "Dollar falls on surprise drop in US retail sales",
        "usedFor": [
          "retail sales -0.6%",
          "expected slight rise",
          "Fed hike probability direction"
        ]
      },
      {
        "accessedAt": "2026-08-17T04:59:02Z",
        "narrationAttribution": "Reuters",
        "publishedAt": "2026-08-14",
        "publisher": "Reuters",
        "reference": "https://www.reuters.com/world/china/global-markets-wrapup-1-2026-08-14/",
        "sourceId": "source-008",
        "sourceType": "major-media",
        "title": "Oil prices rally, US data dents chances of Fed rate hike",
        "usedFor": [
          "oil rise",
          "Hormuz/Iran risk",
          "global market overlay"
        ]
      }
    ],
    "visualSourceIntents": [],
    "visualSourceSelection": null,
    "scenes": [
      {
        "beats": [
          {
            "changeCue": "next",
            "contentType": "text",
            "evidenceSourceIds": [
              "source-001",
              "source-004",
              "source-005"
            ],
            "grammarId": "contradiction",
            "primaryElement": "好決算でもAMAT -5.12%",
            "primaryFunction": "Explain",
            "screenQuestion": "何が矛盾している？",
            "screenState": "Data",
            "transitionRole": "major-shift",
            "viewerTexts": [
              "NASDAQ -0.28%",
              "AMAT -5.12%",
              "決算はbeat-and-raise"
            ],
            "visualMode": "conclusion-card",
            "visualTemplate": "opening-contradiction"
          },
          {
            "changeCue": "next",
            "contentType": "text",
            "evidenceSourceIds": [
              "source-001"
            ],
            "grammarId": "evidence",
            "primaryElement": "AMD +6.50%",
            "primaryFunction": "Explain",
            "screenQuestion": "全面安だった？",
            "screenState": "Data",
            "transitionRole": "continuation",
            "viewerTexts": [
              "AMD +6.50%",
              "SOXX ETF -0.06%",
              "半導体全面安ではない"
            ],
            "visualMode": "conclusion-card",
            "visualTemplate": "hero-number"
          }
        ],
        "causalScope": "multiple",
        "chunks": [
          {
            "expression": "軽い驚き",
            "text": "おはようございます。昨夜のNasdaq Compositeは〇・二八パーセント下落しました。まず目に留まるのがApplied Materialsです。株価は約五パーセント下がったのに、決算は売上も次の四半期ガイダンスも市場予想を上回っていました。"
          },
          {
            "expression": "分析",